### ISSUE TITLE
Traffic Mirroring Task: tcpdump not showing as provided in the task

### ISSUE THREAD

**Issue by bhaskar-reddy** [istio/istio.io#4415]
In [Mirroring traffic to v2](https://preliminary.istio.io/docs/tasks/traffic-management/mirroring/#mirroring-traffic-to-v2) section, point # 3, to examine traffic internals, when I try:
> kubectl exec -it $SLEEP_POD -c istio-proxy -- sudo tcpdump -A -s 0 host $V1_POD_IP or host $V2_POD_IP

I DO NOT see tcpdump info as mentioned in the task. Rather, I see it like this.

> tcpdump: verbose output suppressed, use -v or -vv for full protocol decode
> listening on eth0, link-type EN10MB (Ethernet), capture size 262144 bytes
> 
> 
> 21:48:53.888017 IP sleep-6fdd5df6f6-wjwpj.37554 > 10-240-3-47.httpbin.default.svc.cluster.local.80: Flags [S], seq 1640880792, win 26733, options [mss 8911,sackOK,TS val 3165413812 ecr 0,nop,wscale 7], length 0
> E..<..@.@.].
> .."
> ../...Pa.........hm._...."....
> ..a.........
> 21:48:53.888133 IP sleep-6fdd5df6f6-wjwpj.49914 > 10-240-2-246.httpbin.default.svc.cluster.local.80: Flags [S], seq 3420848774, win 26733, options [mss 8911,sackOK,TS val 825363353 ecr 0,nop,wscale 7], length 0
> E..<g.@.@...
> .."
> ......P..........hm.&...."....
> 12..........
> 21:48:53.888481 IP 10-240-2-246.httpbin.default.svc.cluster.local.80 > sleep-6fdd5df6f6-wjwpj.49914: Flags [S.], seq 1197880840, ack 3420848775, win 26697, options [mss 8911,sackOK,TS val 120730174 ecr 825363353,nop,wscale 7], length 0
> E..<..@.>...
> ...
> ..".P..Gf6.......hI 2...."....
> .22>12......
> 21:48:53.888497 IP sleep-6fdd5df6f6-wjwpj.49914 > 10-240-2-246.httpbin.default.svc.cluster.local.80: Flags [.], ack 1, win 209, options [nop,nop,TS val 825363354 ecr 120730174], length 0
> E..4g.@.@...
> .."
> ......P....Gf6	...........
> 12...22>
> 21:48:53.888522 IP sleep-6fdd5df6f6-wjwpj.49914 > 10-240-2-246.httpbin.default.svc.cluster.local.80: Flags [P.], seq 1:206, ack 1, win 209, options [nop,nop,TS val 825363354 ecr 120730174], length 205: HTTP
> E...g.@.@...
> .."
> ......P....Gf6	...........
> 12...22>...........j.6l...d6..`.//.."(/......u..P......+.../...	...../.,.0.
> .....5.......:.8..5outbound_.8000_.v2_.httpbin.default.svc.cluster.local..........
> ...............#.........istio........................
> 21:48:53.888661 IP 10-240-3-47.httpbin.default.svc.cluster.local.80 > sleep-6fdd5df6f6-wjwpj.37554: Flags [S.], seq 1439272661, ack 1640880793, win 26697, options [mss 8911,sackOK,TS val 1972275888 ecr 3165413812,nop,wscale 7], length 0
> E..<..@.>...
> ../
> ..".P..U...a.....hI......"....
> u.....a.....
> 21:48:53.888670 IP sleep-6fdd5df6f6-wjwpj.37554 > 10-240-3-47.httpbin.default.svc.cluster.local.80: Flags [.], ack 1, win 209, options [nop,nop,TS val 3165413813 ecr 1972275888], length 0
> E..4..@.@.].
> .."
> ../...Pa...U........W.....
> ..a.u...
> 21:48:53.889251 IP 10-240-3-47.httpbin.default.svc.cluster.local.80 > sleep-6fdd5df6f6-wjwpj.37554: Flags [.], ack 206, win 217, options [nop,nop,TS val 1972275889 ecr 3165413813], length 0
> E..4.i@.>..*
> ../
> ..".P..U...a..f.....;.....
> u.....a.
> 21:48:53.890045 IP 10-240-3-47.httpbin.default.svc.cluster.local.80 > sleep-6fdd5df6f6-wjwpj.37554: Flags [P.], seq 1:1261, ack 206, win 217, options [nop,nop,TS val 1972275889 ecr 3165413813], length 1260: HTTP
> E.. .j@.>..=
> ../
> ..".P..U...a..f.....
> .....
> u.....a.....?...;..]...zD@Zr.....c..L..R...DOWNGRD.../...................#......+...'..$..!0...0..........0.9.....L..h.peu0..	*.H........0.1.0...U.
> ..cluster.local0...190610135703Z..190908135703Z0.0.."0..	*.H.............0..
> ..............M....24.aK.~.z/8.Ov<.d? .?e..d.Q....6Ppj
> ...*8.B....Tw.5}..Mv....1e2.=JZ..0...6&......I..n..T..{...b.
> ..0..0C$..k>...t%~.ug.....oG<n...N.tgI....7.....)..'....?r/z.....P^....w?.X.........Z....[.N} .X.*f..b->bS.....~..!q.......kD.G~7..c..!.{...@UKr/......{0y0...U...........0...U.%..0...+.........+.......0...U.......0.0:..U......00..,spiffe://cluster.local/ns/default/sa/default0..	*.H.............**.*.L....S...q.M.o....y......\....m.....,..e.....@.m....%.....
> 5p..".E3...
> ..B.`FV...f......A ?A.. .p.X`.....1....	.v^>..........^..\..*.?;Z.........7...._s}.J.{.......;...o."...........8
> K@o...0.o...WQ.dpb...+..........Kz ........-...`.........#...=)..X.....,...(... @..7..."b......C..v..'.........`....q..@... X..F......(w5.K...........L}..ot........qtUi..-....N..FX.Y-.1.V...F.n.`........O`.,..Jf..o.~^.}..s
> 	...6...VK...........8.$..l....2.
> .l.. 7..Q..l..z.#..D.8@..!...:.0{..@k:..#.J+8...o.zzl...R`..:a.3........n.G..$y6.....3.....y
> /.u....Y.jn%.-...%...2....9...5..@........................0.1.0...U.
> ..cluster.local.........
> 21:48:53.890051 IP sleep-6fdd5df6f6-wjwpj.37554 > 10-240-3-47.httpbin.default.svc.cluster.local.80: Flags [.], ack 1261, win 229, options [nop,nop,TS val 3165413814 ecr 1972275889], length 0
> E..4..@.@.].
> .."
> ../...Pa..fU........W.....
> ..a.u...
> 21:48:53.891369 IP sleep-6fdd5df6f6-wjwpj.49914 > 10-240-2-246.httpbin.default.svc.cluster.local.80: Flags [P.], seq 206:1384, ack 1261, win 229, options [nop,nop,TS val 825363356 ecr 120730176], length 1178: HTTP
> E...g.@.@..N
> .."
> ......P...TGf:.....!......
> 12...22@....+...'..$..!0...0..........0.9.....L..h.peu0..	*.H........0.1.0...U.
> ..cluster.local0...190610135703Z..190908135703Z0.0.."0..	*.H.............0..
> ..............M....24.aK.~.z/8.Ov<.d? .?e..d.Q....6Ppj
> ...*8.B....Tw.5}..Mv....1e2.=JZ..0...6&......I..n..T..{...b.
> ..0..0C$..k>...t%~.ug.....oG<n...N.tgI....7.....)..'....?r/z.....P^....w?.X.........Z....[.N} .X.*f..b->bS.....~..!q.......kD.G~7..c..!.{...@UKr/......{0y0...U...........0...U.%..0...+.........+.......0...U.......0.0:..U......00..,spiffe://cluster.local/ns/default/sa/default0..	*.H.............**.*.L....S...q.M.o....y......\....m.....,..e.....@.m....%.....
> 5p..".E3...
> ..B.`FV...f......A ?A.. .p.X`.....1....	.v^>..........^..\..*.?;Z.........7...._s}.J.{.......;...o."...........8
> K@o...0.o...WQ.dpb...+..........Kz ........-...`.........#...=)..X.....%...! ..	.....8.{..K...sN$I9...S.,.M.$..............kh....+!....k.g....
> .......:E..W...9......9<.y.P..3..4.$...!VN2....|.K:..W. .....7...g.d..nk.ZZ.;b.o5l.......e":wN..R2Qe}...`1..R6n0.|...<8T..(..6.h..X..8.]......^...V.j.*..6p..w4V/2.....$.F.....dv.7@Mp/*.V............-.b..%.|.....h.._...N..X.k....F~O^..G..........(...........s.lZ........k..j..I..7.....^*
> 21:48:53.891880 IP 10-240-2-246.httpbin.default.svc.cluster.local.80 > sleep-6fdd5df6f6-wjwpj.49914: Flags [P.], seq 1261:2335, ack 1384, win 236, options [nop,nop,TS val 120730178 ecr 825363356], length 1074: HTTP
> E..f..@.>.	.
> ...
> ..".P..Gf:................
> .22B12.............. ..\..KH.5R...(...{.r.e;.3..........7..}./r.3...p...o..c..]X.....Z.........}......C...Na.v.o.v.p+.........}..";..i.&.O....>]...H../.a.c..Jzom....`....{.g..1.nT...k..^.<D13.....0.!......E.....L......s..:..........`..0..Mt.......,+.!...1B^...Y..l.......^......>..7.6..	#.:.m[*...=.)~0d .b.....,.....;..*.....A....Y....n.(....B.>..4PS..O.v.BC.~.z.6...D.:.Ce.+.+........{......w..\*....F.....s
> O%...kl.#...2.).7..G........a.I..u~.~..".~..... .....WU...h...`... 6n.Q../r.,6a@.C]....`PV.........z.Mp/......"...:.WA...%GR......K..4.8..F.....$=.e........r..'.k
> T.....2...gu!D..UR%.<.....5`......}.+.w*6j`.j...u.`..8(.-u(&.eo.......3.q.........86...pRC+..R...m_...!..8.i...7.<.sy..&..g...h"..^T-G.QY.....c.&>...._a_.vDo..............6..VW3...[....a.]...A...D./.`p`jj.....b8.D.U ..".W.....q....ID..6to../q..p..q8...|..BC.x.....$....|k...`@..h.GC.d...v...Y.+....>....{..X.#7.*a.OR.R=$....W...d...U...........:Wno..IGK>.,e...W."0c..d.2./.V.y.:....Z...pJK~g.R..!A'Mk....}u]......T8..-{.%2......S....Dy)...&.&..hH.wl...................(.........u....f.8t..5..i.......F+.T.....
> 21:48:53.893027 IP sleep-6fdd5df6f6-wjwpj.37554 > 10-240-3-47.httpbin.default.svc.cluster.local.80: Flags [P.], seq 206:1384, ack 1261, win 229, options [nop,nop,TS val 3165413817 ecr 1972275889], length 1178: HTTP
> E.....@.@.X.
> .."
> ../...Pa..fU.......!......
> ..a.u.......+...'..$..!0...0..........0.9.....L..h.peu0..	*.H........0.1.0...U.
> ..cluster.local0...190610135703Z..190908135703Z0.0.."0..	*.H.............0..
> ..............M....24.aK.~.z/8.Ov<.d? .?e..d.Q....6Ppj
> ...*8.B....Tw.5}..Mv....1e2.=JZ..0...6&......I..n..T..{...b.
> ..0..0C$..k>...t%~.ug.....oG<n...N.tgI....7.....)..'....?r/z.....P^....w?.X.........Z....[.N} .X.*f..b->bS.....~..!q.......kD.G~7..c..!.{...@UKr/......{0y0...U...........0...U.%..0...+.........+.......0...U.......0.0:..U......00..,spiffe://cluster.local/ns/default/sa/default0..	*.H.............**.*.L....S...q.M.o....y......\....m.....,..e.....@.m....%.....
> 5p..".E3...
> ..B.`FV...f......A ?A.. .p.X`.....1....	.v^>..........^..\..*.?;Z.........7...._s}.J.{.......;...o."...........8
> K@o...0.o...WQ.dpb...+..........Kz ........-...`.........#...=)..X.....%...! ..S........1.Q...X.(.C/..p'...z.............."....er.5..t.@ipw..PZ...K.... ..V......X5.(R.....0..Ee	....Z..z.a.k..{....$..Nr%L.xkR..@...x.WFb...l>.H......M..^:t.........k.|....}i.=*M....h.9F....nH......i..yc.c..N...qa.L8H.... .d.c.eT..8..h..1.;?.v.. 7...S.Y..5..O....SN.o..h.m.g...7L.7....#Tky. ................(........$.+i0.9m;)..sn........C.... iN..
> 21:48:53.893141 IP sleep-6fdd5df6f6-wjwpj.49914 > 10-240-2-246.httpbin.default.svc.cluster.local.80: Flags [P.], seq 1384:2218, ack 2335, win 249, options [nop,nop,TS val 825363358 ecr 120730178], length 834: HTTP
> E..vg.@.@...
> .."
> ......P....Gf?'.... `.....
> 12...22B....=........>\..........E~?...ND+.E.r..n|XU+..v?..Z.ft.M.E.>..r.'.Q...../..o......
> .../..m<V........o.P.A.........^9>I.D..0T.....FRt..*!kiZxW}..{.6...G....<.J..(.e.....PD{5....... h#.1G......]m...@.D!2.*R.wV.\.#..i..Inp..\.........n.h............<...Dp!-..h,_..:<-.../.j..}.Z.w..z.&1...^}.F.....z..AH...@..pxz.......F.C"	..Y......88$.,8].u_.k.N.J|r.$.....E.v..ps.X=...A.._Pk......5V|{.. .	..m.8n....s{.;.[TO...r:.%.o.lW..[L.....*.c..m.&..G.4mL...U..!&B(...U.fT.?..V..f8.b..cc^.z..K........5dg..A..h]...$....7rw..:T............%s.....>(7. g...{..~fR.....H..U{\.^<..."GE9g..q.MG. .o].`.Zz......[=...<{/.7)..OT..a...J.jj...V..J.Y.W.'q...#....*.Bbo..'..6....y.d'........N.P.Pw.L.gd.......o.............x...].@`...54.1X.9..4z|X+..J..	Y.B.p...T..;n".1. .Qb3qL7(....}FCx.{..T...&...T.@8..M..	?..^/.y..j..3..c....Q..B..	.hQX %d.7.....:s..iU.
> 21:48:53.893850 IP 10-240-3-47.httpbin.default.svc.cluster.local.80 > sleep-6fdd5df6f6-wjwpj.37554: Flags [P.], seq 1261:2335, ack 1384, win 236, options [nop,nop,TS val 1972275893 ecr 3165413817], length 1074: HTTP
> E..f.k@.>...
> ../
> ..".P..U...a..............
> u.....a............. ..N.+..h........qP.k...[h.U......i.....{..M...b.P.q.....J....Q*I.3...B...	.h.%.dR..+......"2..B.y......1../.>...._. ,V<...pK..).....2A{F.....F.sq.Y....v5....B'.....j9S2e..-sa.....ik
> ...
> .^.....u0f.T
> hR8)..|(.0C..`..3..F..xR...5Kh..m.....>.t&BJ'}..E......wE..y.wm..#..h...#3J"P.!..V..aL~...T^......O....P..>...>.+....,....h...._..+G...j.RH-t7.nO..%..[G.$.....DC......<......TNV..:4..E.	 ...N.....s.].--..:=\+....G.	H...a.u.^..i.}..J.Q.U...K.).FnC........4....S6...e.*..5.3.y..e!k.....RQ....*...C...T...m&`/v*....r.!../.."o.....+S".o.'S.k..(......W...s.;.......
> ...Q..q..L....&ys.1dY2a.7.W.....L.gp.yd..w.j...t]...:...Q..f.(l..f...O.D...."`U...b.<d..'{;0...../8.?x.*<F.....V...c
> ..a....W.|...{N4..n..]A.....X..O....g...._.^^.l.vV......F..s~./|S....t]_OV.7..&.}.>..<.2....N84pr.$u..R.5L..7%?.Y...a.Ko.`....bd..(.f~..s.8..9.......>#..)cK.e8..9.b.]J..y...B.\....".........$...6!N>0[...T..........q....%d+.y....-57..xk..`3n._!...;....N7"$	.U.pF. .b..te.a.==....
> %.-~...Bv.]..9...E./
> ....7..:-h..Wb<H.3.*..m1vx...{.GA..........(........B...l.8......z..	X*."..1..&.`..
> 
> 21:48:53.893933 IP sleep-6fdd5df6f6-wjwpj.37554 > 10-240-3-47.httpbin.default.svc.cluster.local.80: Flags [P.], seq 1384:2199, ack 2335, win 249, options [nop,nop,TS val 3165413818 ecr 1972275893], length 815: HTTP
> E..c..@.@.Za
> .."
> ../...Pa...U....... ......
> ..a.u.......*........F.:.....h....E."
> ....@...:.*...MuM.G.[vf..e. Q..t.1........N2...}'..|.....o.V..!?#N..."R.......-....f.?...-2..q>..]..q......C..3.cGP....H.......w"..Pw++'...t...R......0....."P..GE...c.{."..=~n..n..z..$E.8osB..b$dRu.J..
> .d.r9ST6n^...G..V.}.r 	G..R..9.kD]..........,...=......k.....^T.F.F.tI..oR>.9L...)[Vii..;....."`E..Kq.Pxd.Wc..lwq..B......Lf-.2.......(LN.5,...s]eD..BGA3..)....3t0t.oOl.....F....f&n.UC.MmH.......v.......dV....S.._......!CzE.u.M...s.KN.....{|....I|.>r..`t..	..*..@.9...5'..U......A...W9.9>.*.pU.u..d.:2...."......!...?...w6....S<1..C14>....2.:/....Zg......".....^.....<..5...Q'..'...HL.42<.....FH.k....N9):a|..."|.S..&....Yk[N.)...)d
> E95.D"......J....6{.8aT49.......B..M......R..h.p......w..=.!..;..p6..l...v..|..(...D3..=.z!.3F.....8....p...E}..tS^.....Z....&..J5.].L!Xw.....tk`...i@
> 21:48:53.895006 IP 10-240-2-246.httpbin.default.svc.cluster.local.80 > sleep-6fdd5df6f6-wjwpj.49914: Flags [P.], seq 2335:2600, ack 2218, win 254, options [nop,nop,TS val 120730181 ecr 825363358], length 265: HTTP
> E..=..@.>..!
> ...
> ..".P..Gf?'...0....H......
> .22E12...............\......
> .....p.oW..;.TFj..$...o.w....8...x.c..........q
> 1.ca.b........*..Cf...?..Q..h,.{}.N...T._*...~p..$.h...;..i.O..-.i*!c.2r..[Z..P...C.s'*.}b.w0J.l.'....1U+.'s
> ...O.H{P1.S.wtH....B.....}
> 8..YN,?.}.U..D...Xe...[.A.Z.]X..>..E..:...x~..*H.z..7S...?||
> 21:48:53.895164 IP 10-240-2-246.httpbin.default.svc.cluster.local.80 > sleep-6fdd5df6f6-wjwpj.49914: Flags [P.], seq 2600:3154, ack 2218, win 254, options [nop,nop,TS val 120730181 ecr 825363358], length 554: HTTP
> E..^..@.>...
> ...
> ..".P..Gf@0...0....~......
> .22E12......%...................~n....4z.h(.....=x.Ni..h.aHoQ..
> ..X.Qi.;.:......~...g.Ci.......J.a..B.j..Q...t.5.......q..z4....8..(..
> 2"o..$...#9@g.;...%..m....vO......|....l.F.2..........V..T..4..IU.i%....IN....9.F1i.*..3..........o"..l...?...k....H..;u............0..`..m....S....Q+..YR..T{}k.<?:.'
> ..%.c........NSG........!f.. u.......L...1.[W.Eh...	.V5..)K.../qr..%x..].....c......5h..b...{. ..H.R.....JE.. ~.M..V.v..u..1.....iOW5..K+.._.iYU...%..O...j.jlV.'."..~@bk.`.T....d.	.;....>...f....m..i`.j4.......8.~q.#.>...M.....\./..k6.r....'6.r.....#Fs..iu._..
> 21:48:53.895183 IP sleep-6fdd5df6f6-wjwpj.49914 > 10-240-2-246.httpbin.default.svc.cluster.local.80: Flags [.], ack 3154, win 288, options [nop,nop,TS val 825363360 ecr 120730181], length 0
> E..4g.@.@...
> .."
> ......P...0GfBZ... .......
> 12...22E
> 21:48:53.896210 IP 10-240-3-47.httpbin.default.svc.cluster.local.80 > sleep-6fdd5df6f6-wjwpj.37554: Flags [P.], seq 2335:3151, ack 2199, win 254, options [nop,nop,TS val 1972275896 ecr 3165413818], length 816: HTTP
> E..d.l@.>...
> ../
> ..".P..U...a../.....I.....
> u.....a.....+.............s.".".r..>....D...w.\Pd...
> ..A....#...SZj7..2........>...V=....a..j,..m$..Rm.....	+'.....'..u_,....<.i...jmI.....tC..1.......1.h{>..!hz.F....a h..Sd...c...Tu..f.*.u{.S...q.e..'..]BP.w.U!..)../.......H........;.......=...q\.~..m"..r..;.V...^.aZl}..E9:]	..p^..g..-P}j..G.....6B.-.......XL..5..&.+{.8.z.....k.>H..!W.k.5.-...f.}.....5..5...].^p..u.....a...z.~.$..3..$n.N.....y.C..(.vWF.U`...._..q...1|..\S......Al...^j*.\....^[..;...~....3...k.\".rr.....ph.eP)H..{.....7c..&..J..;...+..."..2..%........1...q...Q....LG..I...(E....-........Brn...~.)8....5.....j..h';..........c/y..
> JL9.i...PO.$.n6y.M....r$%.B..;.#j.,..ZZ.w..Z..`L...)h.S +.I.@
> .......%.`...M..PW+.._5]..r........B...."...w..z .._f[.5k#..t..~gI.....a...v..s..V.....;F...S8u.J..I.W..#.yF.t.&-%?....=y=.J....;.Rp
> ....1(...4l.....v..;5#Py.)
> 21:48:53.936770 IP sleep-6fdd5df6f6-wjwpj.37554 > 10-240-3-47.httpbin.default.svc.cluster.local.80: Flags [.], ack 3151, win 268, options [nop,nop,TS val 3165413861 ecr 1972275896], length 0
> E..4..@.@.].
> .."
> ../...Pa../U..$.....W.....
> ..a.u...
> 

Is it possible the other operators would also be seeing it this way? Is there anything I am missing?
